{
  "event": "custom_metadata_values:update",
  "message": "john.smith updated custom metadata value Platform for key application.modal.header in project Translation Project within branch new-feature-1",
  "user": {
    "id": "24b9a53ad72e198ca332fba91bb95f57",
    "username": "john.smith",
    "name": "John Smith",
    "gravatar_uid": "1bc5edb4799fd8eec67c66122f47eb73"
  },
  "project": {
    "id": "b2abd3bd2c23ff0ac546e0a2d9aa0be1",
    "name": "Translation Project",
    "slug": "translation-project",
    "main_format": "yml",
    "project_image_url": null,
    "created_at": "2025-02-07 16:18:13 UTC",
    "updated_at": "2025-02-07 16:18:13 UTC",
    "point_of_contact": null
  },
  "branch": {
    "name": "new-feature-1"
  },
  "custom_metadata_value": {
    "id": "2e7d22d447a0941ea534b09176da7b83",
    "name": "Platform",
    "value": "Android"
  },
  "key": {
    "id": "fe5b97045d80f91dd950b695d5ebe607",
    "name": "application.modal.header",
    "plural": false,
    "data_type": "string",
    "tags": [
      "web"
    ]
  }
}